{
  "allowed_actions": [
    "AI判断正确",
    "应该更好",
    "应该更差",
    "特效类型错误",
    "风格判断错误",
    "主体不清楚",
    "层次有问题",
    "节奏有问题",
    "材质有问题",
    "无法播放",
    "无法判断"
  ],
  "batch_id": "prefab_active_review_full_r005",
  "created_at": "2026-09-03T02:43:12.005788+00:00",
  "record_count": 16,
  "records": [
    {
      "ai_draft": {
        "label_provenance": {
          "confidence": 0.45,
          "created_at": "2026-09-02T12:26:58.869796+00:00",
          "distance": null,
          "label_source": "ai_pseudo_label",
          "model_version": "weak_metadata_visual_teacher.v1",
          "parent_human_record_id": null,
          "reviewer": null
        },
        "labels": {
          "decision": null,
          "issues": [],
          "observed_color_tags": [],
          "observed_element_tags": [
            "slash"
          ],
          "quality_score": null,
          "scores": {},
          "target_color_tags": [],
          "target_effect_family": null
        },
        "training": {
          "eligible_tasks": [
            "element_semisupervision",
            "color_semisupervision",
            "active_learning_priority"
          ],
          "excluded_tasks": [
            "human_gold",
            "regression_evaluation",
            "model_promotion",
            "preference_training"
          ],
          "expires_with_model_version": true,
          "frozen": false,
          "split": "test",
          "weight": 0.09000000000000001
        }
      },
      "ai_summary_cn": "元素：刀光；颜色：未判断",
      "allowed_actions": [
        "AI判断正确",
        "应该更好",
        "应该更差",
        "特效类型错误",
        "风格判断错误",
        "主体不清楚",
        "层次有问题",
        "节奏有问题",
        "材质有问题",
        "无法播放",
        "无法判断"
      ],
      "capture_manifest_path": "workspace/data/vfx_generation/captures/sword_slash_timing_r002/cases/full_prefab_0001_5b7d7f902fb3/capture_manifest.json",
      "capture_pipeline_version": "play_mode_runtime_isolated_multiview.v2",
      "cluster_id": "cluster_5b7d7f902fb3",
      "frames": [
        {
          "path": "workspace/data/vfx_generation/captures/sword_slash_timing_r002/cases/full_prefab_0001_5b7d7f902fb3/captures/frame_000_0_000.png",
          "time_seconds": 0.0
        },
        {
          "path": "workspace/data/vfx_generation/captures/sword_slash_timing_r002/cases/full_prefab_0001_5b7d7f902fb3/captures/frame_001_0_015.png",
          "time_seconds": 0.014999999664723873
        },
        {
          "path": "workspace/data/vfx_generation/captures/sword_slash_timing_r002/cases/full_prefab_0001_5b7d7f902fb3/captures/frame_002_0_030.png",
          "time_seconds": 0.029999999329447746
        },
        {
          "path": "workspace/data/vfx_generation/captures/sword_slash_timing_r002/cases/full_prefab_0001_5b7d7f902fb3/captures/frame_003_0_045.png",
          "time_seconds": 0.04500000178813934
        },
        {
          "path": "workspace/data/vfx_generation/captures/sword_slash_timing_r002/cases/full_prefab_0001_5b7d7f902fb3/captures/frame_004_0_060.png",
          "time_seconds": 0.05999999865889549
        },
        {
          "path": "workspace/data/vfx_generation/captures/sword_slash_timing_r002/cases/full_prefab_0001_5b7d7f902fb3/captures/frame_005_0_075.png",
          "time_seconds": 0.07500000298023224
        },
        {
          "path": "workspace/data/vfx_generation/captures/sword_slash_timing_r002/cases/full_prefab_0001_5b7d7f902fb3/captures/frame_006_0_090.png",
          "time_seconds": 0.09000000357627869
        },
        {
          "path": "workspace/data/vfx_generation/captures/sword_slash_timing_r002/cases/full_prefab_0001_5b7d7f902fb3/captures/frame_007_0_105.png",
          "time_seconds": 0.10499999672174454
        },
        {
          "path": "workspace/data/vfx_generation/captures/sword_slash_timing_r002/cases/full_prefab_0001_5b7d7f902fb3/captures/frame_008_0_120.png",
          "time_seconds": 0.11999999731779099
        },
        {
          "path": "workspace/data/vfx_generation/captures/sword_slash_timing_r002/cases/full_prefab_0001_5b7d7f902fb3/captures/frame_009_0_135.png",
          "time_seconds": 0.13500000536441803
        },
        {
          "path": "workspace/data/vfx_generation/captures/sword_slash_timing_r002/cases/full_prefab_0001_5b7d7f902fb3/captures/frame_010_0_150.png",
          "time_seconds": 0.15000000596046448
        },
        {
          "path": "workspace/data/vfx_generation/captures/sword_slash_timing_r002/cases/full_prefab_0001_5b7d7f902fb3/captures/frame_011_0_165.png",
          "time_seconds": 0.16500000655651093
        },
        {
          "path": "workspace/data/vfx_generation/captures/sword_slash_timing_r002/cases/full_prefab_0001_5b7d7f902fb3/captures/frame_012_0_180.png",
          "time_seconds": 0.18000000715255737
        },
        {
          "path": "workspace/data/vfx_generation/captures/sword_slash_timing_r002/cases/full_prefab_0001_5b7d7f902fb3/captures/frame_013_0_195.png",
          "time_seconds": 0.19499999284744263
        },
        {
          "path": "workspace/data/vfx_generation/captures/sword_slash_timing_r002/cases/full_prefab_0001_5b7d7f902fb3/captures/frame_014_0_210.png",
          "time_seconds": 0.20999999344348907
        },
        {
          "path": "workspace/data/vfx_generation/captures/sword_slash_timing_r002/cases/full_prefab_0001_5b7d7f902fb3/captures/frame_015_0_225.png",
          "time_seconds": 0.22499999403953552
        },
        {
          "path": "workspace/data/vfx_generation/captures/sword_slash_timing_r002/cases/full_prefab_0001_5b7d7f902fb3/captures/frame_016_0_240.png",
          "time_seconds": 0.23999999463558197
        },
        {
          "path": "workspace/data/vfx_generation/captures/sword_slash_timing_r002/cases/full_prefab_0001_5b7d7f902fb3/captures/frame_017_0_255.png",
          "time_seconds": 0.2549999952316284
        },
        {
          "path": "workspace/data/vfx_generation/captures/sword_slash_timing_r002/cases/full_prefab_0001_5b7d7f902fb3/captures/frame_018_0_270.png",
          "time_seconds": 0.27000001072883606
        },
        {
          "path": "workspace/data/vfx_generation/captures/sword_slash_timing_r002/cases/full_prefab_0001_5b7d7f902fb3/captures/frame_019_0_285.png",
          "time_seconds": 0.2849999964237213
        },
        {
          "path": "workspace/data/vfx_generation/captures/sword_slash_timing_r002/cases/full_prefab_0001_5b7d7f902fb3/captures/frame_020_0_300.png",
          "time_seconds": 0.30000001192092896
        }
      ],
      "peak_frame_index": 9,
      "prefab_path": "Assets/Hovl Studio/Sword slash VFX/Prefabs/Sword Slash 1.prefab",
      "priority_score": 0.507721,
      "review_index": 1,
      "sample_id": "sample_0d53ff02e6a144c86a58",
      "selection_reason": "uncertainty",
      "selection_reason_cn": "AI不确定",
      "webgl_preview": null
    },
    {
      "ai_draft": {
        "label_provenance": {
          "confidence": 0.65,
          "created_at": "2026-09-02T12:26:57.851308+00:00",
          "distance": null,
          "label_source": "ai_pseudo_label",
          "model_version": "weak_metadata_visual_teacher.v1",
          "parent_human_record_id": null,
          "reviewer": null
        },
        "labels": {
          "decision": null,
          "issues": [],
          "observed_color_tags": [
            "blue",
            "orange",
            "yellow"
          ],
          "observed_element_tags": [],
          "quality_score": null,
          "scores": {},
          "target_color_tags": [],
          "target_effect_family": null
        },
        "training": {
          "eligible_tasks": [
            "element_semisupervision",
            "color_semisupervision",
            "active_learning_priority"
          ],
          "excluded_tasks": [
            "human_gold",
            "regression_evaluation",
            "model_promotion",
            "preference_training"
          ],
          "expires_with_model_version": true,
          "frozen": false,
          "split": "validation",
          "weight": 0.13
        }
      },
      "ai_summary_cn": "元素：未判断；颜色：蓝色、橙色、黄色",
      "allowed_actions": [
        "AI判断正确",
        "应该更好",
        "应该更差",
        "特效类型错误",
        "风格判断错误",
        "主体不清楚",
        "层次有问题",
        "节奏有问题",
        "材质有问题",
        "无法播放",
        "无法判断"
      ],
      "capture_manifest_path": "workspace/data/vfx_generation/captures/full_prefab_capture_r002/cases/full_prefab_0028_0cfb9af4e9af/capture_manifest.json",
      "capture_pipeline_version": "play_mode_runtime_isolated_multiview.v2",
      "cluster_id": "cluster_cb8f42a7e7a8",
      "frames": [
        {
          "path": "workspace/data/vfx_generation/captures/full_prefab_capture_r002/cases/full_prefab_0028_0cfb9af4e9af/captures/frame_000_0_000.png",
          "time_seconds": 0.0
        },
        {
          "path": "workspace/data/vfx_generation/captures/full_prefab_capture_r002/cases/full_prefab_0028_0cfb9af4e9af/captures/frame_001_0_100.png",
          "time_seconds": 0.10000000149011612
        },
        {
          "path": "workspace/data/vfx_generation/captures/full_prefab_capture_r002/cases/full_prefab_0028_0cfb9af4e9af/captures/frame_002_0_200.png",
          "time_seconds": 0.20000000298023224
        },
        {
          "path": "workspace/data/vfx_generation/captures/full_prefab_capture_r002/cases/full_prefab_0028_0cfb9af4e9af/captures/frame_003_0_300.png",
          "time_seconds": 0.30000001192092896
        },
        {
          "path": "workspace/data/vfx_generation/captures/full_prefab_capture_r002/cases/full_prefab_0028_0cfb9af4e9af/captures/frame_004_0_400.png",
          "time_seconds": 0.4000000059604645
        },
        {
          "path": "workspace/data/vfx_generation/captures/full_prefab_capture_r002/cases/full_prefab_0028_0cfb9af4e9af/captures/frame_005_0_500.png",
          "time_seconds": 0.5
        },
        {